{
	"$schema": "../../packages/contracts/schemas/module.schema.json",
	"schemaVersion": 1,
	"id": "exports.core",
	"package": "@flowdular/module-exports",
	"version": "0.2.7",
	"platformApi": "^0.2.2",
	"profile": "full",
	"capabilities": ["api", "database", "client", "translations", "cli"],
	"platform": {
		"server": true,
		"client": true
	},
	"dependencies": [
		{
			"id": "system.core",
			"range": "^0.9.0"
		},
		{
			"id": "auth.core",
			"range": "^0.14.0"
		}
	],
	"provides": ["exports.lists.v1"],
	"tenancy": "required",
	"locales": ["en", "pl"],
	"stability": "experimental",
	"cli": {
		"catalog": "src/cli/commands.json",
		"entry": "src/cli/index.ts"
	}
}
