{
	"$schema": "../../packages/contracts/schemas/module.schema.json",
	"schemaVersion": 1,
	"id": "expenses.core",
	"package": "@coreloom/module-expenses",
	"version": "0.4.0",
	"profile": "full",
	"capabilities": ["api", "database", "client", "translations"],
	"platform": {
		"server": true,
		"client": true
	},
	"dependencies": [
		{
			"id": "system.core",
			"range": "^0.1.0"
		},
		{
			"id": "auth.core",
			"range": "^0.1.0"
		}
	],
	"tenancy": "required",
	"locales": ["en", "pl"],
	"stability": "experimental"
}
