{
	"$schema": "../../packages/contracts/schemas/module.schema.json",
	"schemaVersion": 1,
	"id": "automations.core",
	"package": "@flowdular/module-automations",
	"version": "0.6.12",
	"profile": "full",
	"capabilities": ["api", "database", "client", "translations", "cli"],
	"platform": {
		"server": true,
		"client": true
	},
	"dependencies": [
		{
			"id": "system.core",
			"range": "^0.9.0"
		},
		{
			"id": "auth.core",
			"range": "^0.14.0"
		},
		{
			"id": "agents.core",
			"range": "^0.15.0"
		},
		{
			"id": "workflows.core",
			"range": "^0.8.0"
		}
	],
	"provides": ["automations.targets.v1", "automations.execution.v1"],
	"requires": [
		{
			"id": "agents.run-queue"
		},
		{
			"id": "workflows.execution.v1",
			"optional": true
		}
	],
	"tenancy": "required",
	"locales": ["en", "pl"],
	"stability": "experimental",
	"cli": {
		"catalog": "src/cli/commands.json",
		"entry": "src/cli/index.ts"
	},
	"platformApi": "^0.1.0"
}
