{
	"$schema": "../../packages/contracts/schemas/module.schema.json",
	"schemaVersion": 1,
	"id": "metering.core",
	"package": "@flowdular/module-metering",
	"version": "0.1.11",
	"platformApi": "^0.2.0",
	"profile": "full",
	"capabilities": ["api", "database", "client", "translations", "cli"],
	"platform": {
		"server": true,
		"client": true
	},
	"dependencies": [
		{
			"id": "system.core",
			"range": "^0.9.0"
		},
		{
			"id": "auth.core",
			"range": "^0.14.0"
		},
		{
			"id": "reports.core",
			"range": "^0.1.0"
		}
	],
	"provides": ["metering.meters.v1"],
	"requires": [
		{
			"id": "notifications.publish.v1",
			"optional": true
		},
		{
			"id": "reports.v1",
			"optional": true
		}
	],
	"tenancy": "required",
	"locales": ["en", "pl"],
	"stability": "experimental",
	"cli": {
		"catalog": "src/cli/commands.json",
		"entry": "src/cli/index.ts"
	}
}
