{
	"$schema": "../../packages/contracts/schemas/module.schema.json",
	"schemaVersion": 1,
	"id": "users.core",
	"package": "@flowdular/module-users",
	"version": "0.11.4",
	"profile": "full",
	"capabilities": ["api", "client", "translations"],
	"platform": {
		"server": true,
		"client": true
	},
	"dependencies": [
		{
			"id": "system.core",
			"range": "^0.9.0"
		},
		{
			"id": "auth.core",
			"range": "^0.14.0"
		},
		{
			"id": "search.core",
			"range": "^0.1.0"
		},
		{
			"id": "import.core",
			"range": "^0.1.0"
		},
		{
			"id": "exports.core",
			"range": "^0.2.0"
		}
	],
	"requires": [
		{
			"id": "search.providers.v1",
			"optional": true
		},
		{
			"id": "import.ports.v1",
			"optional": true
		},
		{
			"id": "exports.lists.v1",
			"optional": true
		}
	],
	"tenancy": "required",
	"locales": ["en", "pl"],
	"stability": "experimental",
	"platformApi": "^0.2.0"
}
