{
	"$schema": "../../packages/contracts/schemas/module.schema.json",
	"schemaVersion": 1,
	"id": "profile.core",
	"package": "@flowdular/module-profile",
	"version": "1.5.4",
	"profile": "full",
	"capabilities": ["api", "database", "client", "translations", "integration"],
	"platform": {
		"server": true,
		"client": true
	},
	"dependencies": [
		{
			"id": "auth.core",
			"range": "^0.14.0"
		}
	],
	"tenancy": "required",
	"locales": ["en", "pl"],
	"stability": "experimental",
	"platformApi": "^0.2.0"
}
