{
	"$schema": "../../packages/contracts/schemas/module.schema.json",
	"schemaVersion": 1,
	"id": "adapters.core",
	"package": "@flowdular/module-adapters",
	"version": "0.1.6",
	"platformApi": "^0.2.2",
	"profile": "full",
	"capabilities": ["api", "database", "client", "translations"],
	"platform": {
		"server": true,
		"client": true
	},
	"dependencies": [
		{
			"id": "system.core",
			"range": "^0.9.0"
		},
		{
			"id": "auth.core",
			"range": "^0.14.0"
		}
	],
	"provides": ["adapters.sources.v1", "adapters.sinks.v1"],
	"requires": [
		{
			"id": "connectors.calls.v1",
			"optional": true
		},
		{
			"id": "connectors.instances.v1",
			"optional": true
		},
		{
			"id": "import.ports.v1",
			"optional": true
		},
		{
			"id": "import.write.v1",
			"optional": true
		},
		{
			"id": "exports.lists.v1",
			"optional": true
		},
		{
			"id": "metering.meters.v1",
			"optional": true
		}
	],
	"tenancy": "required",
	"locales": ["en", "pl"],
	"stability": "experimental"
}
