{
	"$schema": "../../packages/contracts/schemas/module.schema.json",
	"schemaVersion": 1,
	"id": "workflows.core",
	"package": "@flowdular/module-workflows",
	"version": "0.8.0",
	"profile": "full",
	"capabilities": [
		"api",
		"database",
		"client",
		"translations",
		"integration",
		"cli"
	],
	"platform": {
		"server": true,
		"client": true
	},
	"dependencies": [
		{
			"id": "system.core",
			"range": "^0.9.0"
		},
		{
			"id": "auth.core",
			"range": "^0.14.0"
		},
		{
			"id": "agents.core",
			"range": "^0.15.0"
		}
	],
	"provides": ["workflows.execution.v1"],
	"requires": [
		{
			"id": "agents.run-execution.v2"
		},
		{
			"id": "agents.actions.v2"
		},
		{
			"id": "notifications.publish.v1",
			"optional": true
		},
		{
			"id": "approvals.requests.v1",
			"optional": true
		},
		{
			"id": "agents.decisions.v1",
			"optional": true
		}
	],
	"tenancy": "required",
	"locales": ["en", "pl"],
	"stability": "experimental",
	"cli": {
		"catalog": "src/cli/commands.json",
		"entry": "src/cli/index.ts"
	},
	"platformApi": "^0.1.0"
}
