{
	"$schema": "../../packages/contracts/schemas/module.schema.json",
	"schemaVersion": 1,
	"id": "import.core",
	"package": "@flowdular/module-import",
	"version": "0.1.15",
	"platformApi": "^0.2.2",
	"profile": "full",
	"capabilities": ["api", "database", "client", "translations"],
	"platform": {
		"server": true,
		"client": true
	},
	"dependencies": [
		{
			"id": "system.core",
			"range": "^0.9.0"
		},
		{
			"id": "auth.core",
			"range": "^0.14.0"
		},
		{
			"id": "documents.core",
			"range": "^0.3.0"
		}
	],
	"provides": ["import.ports.v1", "import.write.v1"],
	"requires": [
		{
			"id": "documents.attachments.v1"
		}
	],
	"tenancy": "required",
	"locales": ["en", "pl"],
	"stability": "experimental"
}
