{
	"$schema": "../../packages/contracts/schemas/module.schema.json",
	"schemaVersion": 1,
	"id": "system.core",
	"package": "@flowdular/module-system",
	"version": "0.9.2",
	"profile": "full",
	"capabilities": ["api", "database", "client", "translations"],
	"platform": {
		"server": true,
		"client": true
	},
	"dependencies": [],
	"provides": ["system.modules.v1"],
	"tenancy": "required",
	"locales": ["en", "pl"],
	"stability": "experimental",
	"platformApi": "^0.2.0"
}
